{
	"schema_version": "llm_io_fingerprint.v1",
	"run_id": "run_rag_01",
	"request_id": "req_rag_01",
	"trace_id": "trace_rag_01",
	"runtime_release": "execution-control@test",
	"provider_profile_revision": "rag_synthesis:provider_profile_rag:4",
	"provider": "openai",
	"model": "gpt-5-mini",
	"model_params_hash": "sha256:aaaaaaaaaaaaaaaaaaaaaaaaaaaaaaaaaaaaaaaaaaaaaaaaaaaaaaaaaaaaaaaa",
	"prompt_id": "rag_synthesis_answer",
	"prompt_template_sha256": "sha256:bbbbbbbbbbbbbbbbbbbbbbbbbbbbbbbbbbbbbbbbbbbbbbbbbbbbbbbbbbbbbbbb",
	"prompt_variables_schema_version": "rag_synthesis_packet.v1",
	"rendered_prompt_sha256": "sha256:cccccccccccccccccccccccccccccccccccccccccccccccccccccccccccccccc",
	"tool_catalog_sha256": "sha256:dddddddddddddddddddddddddddddddddddddddddddddddddddddddddddddddd",
	"tool_schema_sha256": "sha256:eeeeeeeeeeeeeeeeeeeeeeeeeeeeeeeeeeeeeeeeeeeeeeeeeeeeeeeeeeeeeeee",
	"workflow_artifact_sha256": "sha256:ffffffffffffffffffffffffffffffffffffffffffffffffffffffffffffffff",
	"context_envelope_sha256": "sha256:1111111111111111111111111111111111111111111111111111111111111111",
	"memory_selection_sha256": "sha256:2222222222222222222222222222222222222222222222222222222222222222",
	"evidence_packet_sha256": "sha256:3333333333333333333333333333333333333333333333333333333333333333",
	"output_schema_id": "rag_answer_v2",
	"tool_runtime_fingerprint": {
		"schema_version": "tool_runtime_fingerprint.v1",
		"tools_schema_version": "tool-registry-v4",
		"tools_registry_version": "2026-06-26",
		"tools_sha256": "sha256:dddddddddddddddddddddddddddddddddddddddddddddddddddddddddddddddd",
		"function_schema_version": "tool-function-schemas-v1",
		"function_schema_sha256": "sha256:eeeeeeeeeeeeeeeeeeeeeeeeeeeeeeeeeeeeeeeeeeeeeeeeeeeeeeeeeeeeeeee",
		"workflow_artifact_schema_version": "workflow-artifact-registry-v2",
		"workflow_artifact_registry_version": "2026-05-07",
		"workflow_artifact_sha256": "sha256:ffffffffffffffffffffffffffffffffffffffffffffffffffffffffffffffff",
		"combined_sha256": "sha256:9999999999999999999999999999999999999999999999999999999999999999"
	},
	"llm_call_site": "rag.synthesis",
	"model_params_projection": {
		"schema_version": "model_params_projection.v1",
		"params_schema_version": "provider_model_params.v1",
		"params_sha256": "sha256:aaaaaaaaaaaaaaaaaaaaaaaaaaaaaaaaaaaaaaaaaaaaaaaaaaaaaaaaaaaaaaaa",
		"projected_params": {
			"max_output_tokens": 1200,
			"temperature": null,
			"top_p": null,
			"reasoning_effort": "low",
			"response_format": "json_schema",
			"tool_choice": "none"
		}
	},
	"prompt_registry_attestation": {
		"schema_version": "prompt_registry_attestation.v1",
		"prompt_registry_version": "prompt-registry-v1",
		"prompt_id": "rag_synthesis_answer",
		"prompt_template_sha256": "sha256:bbbbbbbbbbbbbbbbbbbbbbbbbbbbbbbbbbbbbbbbbbbbbbbbbbbbbbbbbbbbbbbb",
		"prompt_variables_schema_version": "rag_synthesis_packet.v1",
		"output_schema_id": "rag_answer_v2",
		"attestation_sha256": "sha256:5555555555555555555555555555555555555555555555555555555555555555"
	},
	"provider_request_safe_hash": {
		"schema_version": "provider_request_safe_hash.v1",
		"canonicalization": "canonical_json_redacted_v1",
		"redaction_policy": "llm_provider_request_safe_projection.v1",
		"request_sha256": "sha256:6666666666666666666666666666666666666666666666666666666666666666"
	},
	"primary_attestation": {
		"schema_version": "primary_attestation.v1",
		"attestation_kind": "primary_admitted_rag_synthesis",
		"attested_by": "apps/execution-control",
		"attestation_sha256": "sha256:8888888888888888888888888888888888888888888888888888888888888888"
	},
	"tool_runtime_attestation": {
		"schema_version": "tool_runtime_attestation.v1",
		"attested_by": "apps/execution-control",
		"config_refs": [
			"configs/runtime/tools.v4.json",
			"configs/runtime/tool-function-schemas.v1.json",
			"configs/runtime/workflow-artifacts.v2.json"
		],
		"tools_registry_version": "2026-06-26",
		"function_schema_version": "tool-function-schemas-v1",
		"workflow_artifact_registry_version": "2026-05-07",
		"combined_sha256": "sha256:9999999999999999999999999999999999999999999999999999999999999999"
	}
}
